{
  "decisionid": "253b4a77-4ba2-4362-b8a5-5ae2701736bb",
  "cycle": "000",
  "tasktype": "implementation",
  "selectedprovider": "cursorcli",
  "reason": "classified_as=implementation;primary=cursorcli;route=cursorcli",
  "billingmode": "cursor_subscription",
  "estimatedcostusd": 0.0,
  "approvedbypolicy": true,
  "decided_at": "2026-06-15T05:02:47.249554+00:00"
}
